{
  "schema_version": "schednav.tenant-predictive-controller/v1",
  "controller_id": "tenant-predictive-spot-v2",
  "model": "tenant-linear-gaussian-v1",
  "demand_sample_interval_seconds": 60,
  "quota_update_interval_seconds": 300,
  "aggregation_interval_seconds": 3600,
  "lookback_hours": 672,
  "forecast_horizon_hours": 4,
  "retrain_interval_seconds": 86400,
  "validation_hours": 168,
  "training_stride_seconds": 300,
  "guarantee_probability": 0.9,
  "guarantee_horizons_hours": [1, 2, 4],
  "business_calendar": "china",
  "moving_average_window": 25,
  "embedding_dimension": 8,
  "attention_hidden_dimension": 16,
  "train_epochs": 10,
  "batch_size": 32,
  "learning_rate": 0.00004,
  "early_stopping_patience": 3,
  "random_seed": 20260807,
  "nonzero_targets_only": true,
  "initial_eta": 1.0,
  "minimum_eta": 0.25,
  "maximum_eta": 1.25,
  "feedback_window_seconds": 14400,
  "queue_wait_threshold_seconds": 3600,
  "high_eviction_multiple": 1.5,
  "low_eviction_multiple": 0.5,
  "runtime_inventory_cap": true,
  "quantile_calibration_method": "validation-residual-nearest-rank"
}
